{
  "ir_version": "1.0",
  "gate_id": "sensitive_surface",
  "gate_type": "bitmask_gate",
  "input_schema": {
    "features": [
      {
        "id": "targets_sensitive_route",
        "type": "bool"
      },
      {
        "id": "origin_outside_trust_zone",
        "type": "bool"
      }
    ]
  },
  "rules": [
    {
      "id": "deny_sensitive_route_from_untrusted_zone",
      "kind": "predicate",
      "bit": 0,
      "deny_when": {
        "all": [
          {
            "feature": "targets_sensitive_route",
            "op": "==",
            "value": true
          },
          {
            "feature": "origin_outside_trust_zone",
            "op": "==",
            "value": true
          }
        ]
      },
      "message": "Sensitive routes are blocked outside the trusted zone."
    }
  ],
  "evaluation": {
    "combine": "bitwise_or",
    "allow_when_bitmask": 0
  },
  "verification": {
    "correctness_scope": "Example WAF sensitive-surface pearl."
  },
  "provenance": {
    "generator": "logicpearl.waf_edge_example",
    "generator_version": "0.1.1"
  }
}
